{
  "module": "src/system.ts",
  "instances": { "node": { "machine": "Node" } },
  "methods": {
    "electionTimeout": { "instance": "node", "action": "ElectionTimeout" },
    "electionWon": { "instance": "node", "action": "ElectionWon" },
    "newerTermSeen": { "instance": "node", "action": "NewerTermSeen", "params": { "seen": "$arg:term" } },
    "quorumLost": { "instance": "node", "action": "QuorumLost" },
    "shutdown": { "instance": "node", "action": "Shutdown" }
  },
  "queries": { "node": { "instance": "node", "fields": { "role": "role", "term": "term" } } }
}
